Study ID,Journal ID,Volume #,Issue #,Year,Title,Author #1,Design,text ,NW,CC,ADVCL,DOBJ,SCONJ,IC,Binary_design
50,JLD,54,2,2021,English Spelling Performance in Writing Samples Among Spanish-Speaking ELLs,Amanda L. Lindner,Non-EXP,"The depth of the English orthography makes reading and spelling in English a difficult task; particularly for English language learners (ELLs) whose first language (L1) has a shallow orthography. Mastering spelling in English is a critical component of increasing the English literacy of ELLs. This study investigated the English spelling of 569 Spanish-speaking ELLs in Grades 4 to 6. ParticipantsÕ writing samples were analyzed for spelling errors. Latent class analysis was utilized to discover hidden categories within the data using eight spelling error categories: (a) Vowel Omission; (b) Vowel Addition; (c) Vowel Substitution; (d) Vowel Sequence; (e) Consonant Omission; (f) Consonant Addition; (g) Consonant Substitution; (h) Consonant Sequence. Consonant- and vowel-based errors were nearly equal in each grade level. Latent class analysis resulted in a two-class model. Students in Class 1 made more types of errors than students in Class 2. As the grade level increased, the percentage of students in Class 2 increased. The results of this study show the effects of English and Spanish orthographies on the spelling of Spanish-speaking ELLs, with spelling errors occurring among both vowels and consonants. As omissions were the most prevalent errors in both classes, spelling instruction aimed at decreasing omissions should be considered for ELLs.",207,0.0,0.0,48.309178743961354,9.66183574879227,0.0,0
51,JLD,54,2,2021,Using Spelling Error Analyses to Examine Individual Differences in German Students From Diverse Linguistic Backgrounds: A Latent Class Approach,Shuai Zhang,Non-EXP,"The current study examined German spelling errors among students with German as their first language (L1) and those with German as their second language (L2) in Grades 3Ð4 (elementary school students;ÊnÊ= 127) and Grades 5Ð7 (secondary school students;ÊnÊ= 379). Five hundred and six students participated in the study. We performed two separate latent class analyses on elementary and secondary school students. Results indicate that elementary school students can be categorized as good (Class 1), consonant error dominant (Class 2), or poor (Class 3) spellers. However, secondary students can be categorized as addition and sequence error dominant (Class 1), substitution and omission error dominant (Class 2), or poor (Class 3) spellers. The three-step multinomial logistic regression analyses suggested that decoding was associated with the highest chances of being poor spellers in both elementary and secondary schools. Speaking German as L1 or L2 was a significant predictor of heterogeneities in secondary, but not elementary, school students. Polish L1 secondary students had the highest possibility of being poor spellers. The results suggest heterogeneities of student profiles. In addition, special attention should be given to secondary school students with the Polish L1 background in their spelling struggles associated with German orthography.",198,0.0,0.0,20.202020202020204,10.101010101010102,0.0,0
52,JLD,54,2,2021,Different Cognitive Correlates of Early Learning of Spelling of Different Target Types in Korean Hangul Among First Language Children and Adult Foreign Language Learners,Jeung-Ryeul Cho,Non-EXP,"This study examined whether different cognitive correlates are associated with spelling of different target types, such as phonologically consistent and inconsistent syllables, of Korean Hangul among 94 five-year-old first language (L1) Korean children and 41 foreign language (FL) learners who are Hong Kong Chinese college students. Korean children performed tasks of spelling, along with measures of syllable and phoneme coda awareness, phonological and orthographic working memory, morphological awareness, vocabulary, and orthographic knowledge. Among Korean 5-year-old children, coda awareness and orthographic working memory explained unique variance in spelling of phonologically consistent syllables, whereas syllable and coda awareness, orthographic working memory, orthographic knowledge, and vocabulary all explained unique variance in spelling of inconsistent syllables. When Chinese college students were tested on spelling of Korean Hangul as a foreign language, along with a battery of tasks in Korean similar to those administered to the L1 children, only orthographic working memory significantly explained spelling of consistent syllables, whereas only vocabulary knowledge explained spelling of inconsistent syllables. In both groups, spelling accuracy was lower in phojnolofgically inconsistent than in consistent Hangul syllables. These findings suggest that different cognitive demands are involved in early spelling of phonologically consistent and inconsistent syllables in Korean Hangul among L1 and FL learners.",207,0.0,0.0,24.154589371980677,24.154589371980677,0.0,0
53,JLD,54,2,2021,A Model of Chinese Spelling Development in Hong Kong Kindergarteners,Yanyan Ye,Non-EXP,"Copying characters presented previously (delayed copying) is an important skill in Chinese literacy acquisition. The relations of delayed copying and a set of literacy-related skills (including vocabulary knowledge, rapid automatized naming, phonological awareness, morphological awareness, and orthographic awareness), visual-orthographic judgment, motor coordination, pure copying of foreign scripts, and delayed copying to Chinese spelling were examined among 294 typically developing Hong Kong kindergarteners. With all other variables statistically controlled, rapid automatized naming, phonological awareness, morphological awareness, orthographic awareness, motor coordination, and delayed copying all uniquely explained Chinese spelling. To further investigate how delayed copying interacts with other skills, path analyses were conducted. The final model showed that vocabulary knowledge, visual-orthographic judgment, and pure copying had indirect effects on spelling through delayed copying. These findings partly support spelling models developed in alphabetic writing systems, but also reflect the uniqueness of Chinese. In addition, results suggest that delayed copying is a unique window into how children learn to write words in Chinese. The potentially critical role of delayed copying in Chinese spelling makes it a potentially good clinical indicator of early spelling proficiency and spelling difficulties.",186,0.0,0.0,43.01075268817205,21.505376344086024,5.376344086021506,0
54,JLD,53,6,2020,The Critical Role of Word Reading as a Predictor of Response to Intervention,Sharon Vaughn,EXP,"This study examines the initial word reading performance of fourth-grade struggling readers and the extent to which differing levels of word reading performance at pretest influenced their response to reading interventions. A large group of students with significant reading comprehension difficulties (NÊ= 481) were classified into three clusters of word reading proficiency based on their pretest performance: (a) very low, (b) low, and (c) near adequate. We examined their performance on several academic, language, and executive functioning measures at the beginning of the year and their reading comprehension performance at the beginning of year and after 1 year of reading intervention to examine how each cluster responded to instruction. Results from a discriminant function analysis indicated that performance on five pretest variables were meaningful predictors of word reading proficiency cluster membership: phonological processing, writing fluency, math calculation, math fluency, and reading efficiency and comprehension. Results also demonstrated that word reading proficiency at pretest was related to response to intervention on reading comprehension measures. Students in the very low word reading proficiency cluster showed minimal response to intervention whereas the near-adequate word reading cluster demonstrated greatest response to intervention. These results suggest word reading is a critical predictor of response to intervention for students with significant comprehension problems in the upper elementary grades and that students with the most substantial word reading problems may require more intensive and specialized treatments than students with greater word reading performance to show meaningful progress in reading.",244,0.0,0.0,81.96721311475409,20.491803278688522,0.0,1
55,JLD,53,6,2020,Comparison of Reading Growth Among Students With Severe Reading Deficits Who Received Intervention to Typically Achieving Students and Students Receiving Special Education,Matthew K. Burns,Non-EXP,"This study compared the reading growth of students with and without learning disabilities, and students with and without reading deficits in response to tier 2 reading interventions within a response-to-intervention framework. Participants were 499 second- and third-grade students in six urban schools. Students who scored at or below the 10th percentile on the fall reading screening assessment were identified as having a severe reading deficit and received a tier 2 reading intervention that was targeted to their needs. Results showed a significant effect between groups on reading growth. Students with severe reading deficits receiving targeted tier 2 intervention grew at a rate that equaled the rate of growth of students without reading deficits and was significantly higher than students who were receiving special education services for reading. Implications for practice, suggestions for future research, and study limitations are discussed.",142,0.0,0.0,84.50704225352112,0.0,0.0,0
56,JLD,53,5,2020,Dynamic Assessment for Identifying Spanish-Speaking English LearnersÕ Risk for Mathematics Disabilities: Does Language of Administration Matter?,Eunsoo Cho,EXP,"We examined dynamic assessmentÕs (DAÕs) added value over traditional assessments for identifying Spanish-speaking English learnersÕ (ELs) risk for developing mathematics disabilities, as a function of the language of test administration (English vs. Spanish), type of math outcome, and ELÕs language dominance. At the start of first grade, ELs (NÊ= 368) were randomly assigned to English-DA or Spanish-DA conditions, were assessed on static mathematics measures and domain-general (language, reasoning) measures in English, and completed DA in their assigned language condition. At yearÕs end, they were assessed on calculation and word-problem solving outcomes in English. Results from multigroup path models indicated that Spanish-DA mitigates the impact of ELsÕ language dominance on DA performance. Moreover, ELsÕ language dominance moderated DAÕs predictive validity differentially depending on DA language and type of outcome. Spanish-DA showed higher predictive validity in Spanish-dominant ELs than English-dominant ELs when predicting calculations but not word-problem solving. English-DA was predictive for both outcomes, regardless of ELsÕ language dominance.",168,0.0,0.0,41.666666666666664,11.904761904761903,0.0,1
57,JLD,53,5,2020,A Common Family Factor Underlying Language Difficulties and Internalizing Problems: Findings From a Population-Based Sibling Study,Siri Saugestad Helland,Non-EXP,"Studies have identified concurrent, longitudinal, and bidirectional associations between language difficulties and internalizing problems. This is commonly explained by social exclusion or withdrawal from peers, but underlying mechanisms are not well understood. This study uses sibling data to investigate if the comorbidity between language difficulties and internalizing problems is best explained by familial factors shared by siblings, such as genes or family environment, or nonfamilial factors specific to each child, such as peer environment. Data include 5,568 siblings at 5 years and 3,654 siblings at 8 years participating in the Norwegian Mother, Father and Child Cohort Study (MoBa). We constructed a latent factor model at 5 and 8 years, including a family comorbidity factor capturing correlations between language and internalizing problems that were equally strong between as within siblings. Results showed that the correlation between one siblingÕs internalizing problems and the other siblingÕs language problems was mostly accounted for by a family comorbidity factor. The best-fitting longitudinal model included stability of the family comorbidity factor and stability of language and internalizing problems within each sibling and no cross-sibling or cross-trait longitudinal associations. This suggests that the association between language and internalizing problems may be best explained by family factors.",202,0.0,0.0,54.45544554455446,14.85148514851485,0.0,0
58,JLD,53,4,2020,Using Video-Based Instruction via Augmented Reality to Teach Mathematics to Middle School Students With Learning Disabilities,Ryan O. Kellems,EXP,"The purpose of this study was to examine the effectiveness of video-based mathematics instruction for seven middle school students with specific learning disability (SLD), using an augmented reality-based training package. The dependent variable was the percentage of steps students performed correctly to solve each type of mathematics problem. The independent variable was the augmented reality video-based intervention, which used video to model the individual steps for solving four types of multistep mathematics problems: (a) addition and subtraction of integers, (b) multiplication and division of integers, (c) using ratio reasoning to convert measurement units, and (d) using multiplication and division to calculate rate of change. Results indicated a functional relation between the video-based mathematics intervention and the percentage of steps completed correctly for each type of problem. All seven participants showed significant gains immediately after receiving the intervention and maintained improved problem-solving skills in at least three out of the four problem categories.",157,0.0,0.0,89.17197452229298,0.0,0.0,1
59,JLD,53,4,2020,Exploring the Relation Between Teacher Factors and Student Growth in Early Writing,Britta Cook Bresina,Non-EXP,"Data from a small randomized control trial of teachersÕ use of Data-Based Instruction (DBI) for early writing were analyzed to determine the influence of teacher knowledge, skills, and treatment fidelity on student Curriculum-Based Measurement (CBM) slope. Participants included 11 elementary grade teachers who delivered intensive intervention in early writing and their students (nÊ= 31), all identified as either at risk for or with disabilities that affect their writing. Teachers received professional development and ongoing coaching to support the implementation of DBI for improving their studentsÕ early writing skills. Results from a multiple regression analysis suggest that teacher knowledge and skills in DBI was strongly related to student CBM slope in early writing (pÊ< .01) and a small but significant relation between fidelity of writing instruction and student CBM slope (pÊ< .01). Implications for instructional coaching and improving student writing progress are discussed.",146,0.0,0.0,75.34246575342465,6.8493150684931505,13.698630136986301,0
60,JLD,53,2,2020,The Effects of Script and Orthographic Complexity on the Handwriting and Spelling Performance of Children with Dyslexia,Barbara Arfe,Non-EXP,"Handwriting and spelling problems are often associated in dyslexia. However, the nature of their association is still unclear, and most of the existing research in this area is on deep orthographies (mainly English). The extent to which findings are applicable across languages is uncertain. This article examines the effects of script (manuscript/cursive) and orthographic complexity (complex/simple spellings) on the word dictation and word-copying performance of a group of 24 Italian children with dyslexia and handwriting difficulties (DH group, aged 8Ð10). Their performance was compared with that of a chronologically ageÐmatched group (CA) and a group of younger children matched to the DH group for their handwriting skills (HA: handwriting age group). Children performed two classical handwriting tasks: the alphabet task and a sentence-copy task, and dictation and copy tasks of orthographically complex words and orthographically simple words. Copying was performed in manuscript and cursive. The results show that although the DH group shows a significant deficit in graphomotor processes, orthographic complexity more than the visual-motor characteristics of the task (i.e., script) affects their performance in handwriting. An advantage for cursive script in DH children, but not in the other two groups, emerges from the study.",200,5.0,5.0,20.0,10.0,5.0,0
61,JLD,53,2,2020,Writing Impairments in Spanish Children With Developmental Dyslexia,Olivia Afonso,Non-EXP,"This study investigated which components of the writing production process are impaired in Spanish children with developmental dyslexia (DD) aged 8 to 12 years. Children with and without dyslexia (nÊ= 60) were assessed in their use of the lexical and the sublexical routes of spelling as well as the orthographic working memory system by manipulating lexical frequency, phonology-to-orthography (P-O) consistency, and word length in a copying task and a spelling-to-dictation task. Results revealed that children with dyslexia produced longer written latencies than chronological age-matched (CA) controls, more errors than CA and reading age-matched (RA) controls, and writing durations similar to CA controls. Latencies were more affected by frequency, consistency, and length in the DD group and the RA group than in CA controls. Children in the DD and RA groups produced longer written latencies in the copying than in the spelling-to-dictation task, while controls in the CA group were not affected by the task. Results indicate that spelling impairments in Spanish children with dyslexia affect the relative involvement of lexical and sublexical information during handwriting. Meanwhile, effects on writing speed seem to be related to deficits in reading ability, and accuracy scores seem to be poorer than expected by childrenÕs reading skill.",211,0.0,0.0,42.65402843601896,18.95734597156398,14.218009478672984,0
62,JLD,53,2,2020,Accuracy and Consistency of Letter Formation in Children With Developmental Coordination Disorder,Mellissa Prunty,EXP,Handwriting difficulties are frequently mentioned in descriptions of developmental coordination disorder (DCD). Recent studies have shown that children with DCD pause more and produce less text than typically developing (TD) peers. This temporal dysfluency indicates a lack of automaticity in handwriting production. One possible contributing factor is the accuracy and consistency of letter formation. The aim of this study was to gain a better understanding of handwriting dysfluency by examining the accuracy and consistency of letter production both within and across different writing tasks. A total of 28 children aged 8 to 15 years with DCD participated in the study with 28 TD age- and gender-matched control participants. They completed the alphabet writing and copy fast tasks fromÊThe Detailed Assessment of Speed of HandwritingÊon a digitizing writing tablet. The accuracy and consistency of letter production were examined. The DCD group had a higher percentage of errors within their letterforms than did the TD peers. Letter production was also less consistent between tasks. Children with DCD appear to have difficulties with the ÒallographÓ (motor program) aspect of handwriting and may require explicit teaching of letter formation.,186,0.0,0.0,64.51612903225806,10.752688172043012,0.0,1
63,JLD,53,2,2020,Teaching GraphemeÐPhoneme Correspondences Using a Direct Mapping Approach for At-Risk Second Language Learners: A Randomized Controlled Trial,Susunna Siu-sze Yeung,EXP,"Reading interventions developed to teach graphemeÐphoneme correspondences (GPCs) were evaluated among L2 at-risk readers. In the direct mapping of grapheme (DMG) condition, childrenÕs attention was explicitly drawn to the application of a graphemes taught on that day to shared reading of words in authentic text. In the control condition there was no such systematic daily linkage of the GPCs and texts. The two reading interventions were otherwise identical. Two hundred fifty-three Chinese Grade 1 and Grade 2 students were screened, and those who scored in the bottom 30% of an English word-reading test were identified as L2 at-risk readers. Seventy-one L2 at-risk readers were thus randomly assigned to two conditions, both of which were small-group reading interventions: (a) DMG or (b) taught control. We hypothesized a significant main effect of Intervention condition and significant interaction of Intervention by Phonological Awareness (PA) effects on word reading, word attack, spelling, and sentence comprehension favoring the DMG intervention. Results showed that predicted interaction effects were significant for word reading, spelling, and sentence comprehension. No other effects were significant. Results suggest that the daily Direct Mapping of taught GPCs to shared book reading promotes reading development in at-risk English L2 readers with stronger phonological skills.",209,0.0,0.0,38.27751196172249,9.569377990430622,0.0,1
64,JLD,53,2,2020,Assessing Foundational Reading Skills in Kindergarten: A Curriculum-Based Measurement in Spanish,Nuria Gutierrez,Non-EXP,"Early identification of learning difficulties is a critical component of the Response to Intervention (RtI) model. In kindergarten, the screening of foundational reading skills can provide a data-based guideline for identifying students requiring a more intensive response-based intervention before starting elementary school. This study examines the classification accuracy and best predictors of a set of Spanish curriculum-based measures administered during kindergarten. The studyÕs sample included 189 students tested in the fall, winter, and spring. Receiver operating characteristic (ROC) analysis was conducted. The composite score of the curriculum-based measurement (CBM) revealed area under the ROC curve (AUC) values of 0.83, 0.97, and 0.94 in the fall, winter, and spring, respectively. Phonemic awareness and letter-sound knowledge were the only isolated measures that demonstrated excellent AUC values throughout kindergarten. Logistic regression models showed that, when entered simultaneously, all measures were significant predictors of reading risk at some moment of the school year.",154,0.0,0.0,64.93506493506493,12.987012987012989,0.0,0
65,JLD,53,1,2020,How Stable Is Early Academic Performance? Using Cluster Analysis to Classify Low Achievement and EF.,Adrienne D. Woods,Non-EXP,"We explored whether and how cognitive measures of executive function (EF) can be used to help classify academic performance in Kindergarten and first grade using nonparametric cluster analysis. We found that EF measures were useful in classifying low-reading performance in both grades, but mathematics performance could be grouped into low, average, and high groups without the use of EF tasks. Membership in the high-performing groups was more stable through first grade than membership in the low or average groups, and certain Kindergarten EF tasks differentially predicted first-grade reading and mathematics cluster membership. Our results suggest a stronger link between EF deficits and low performance than between EF strengths and high performance. We highlight the importance of simultaneously using academic and cognitive skills to classify achievement, particularly since existing classification schemes have been largely based on arbitrary cutoffs using limited academic measures.",144,6.944444444444444,6.944444444444444,62.5,27.777777777777775,6.944444444444444,0
66,JLD,53,1,2020,"A Developmental Examination of Narrative Writing in EL and EL1 School Children Who Are Typical Readers, Poor Decoders, or Poor Comprehenders",Katherine E. D. Herbert,Non-EXP,"This longitudinal study examined story-writing development of students from Grade 4 to Grade 6, comparing the developmental trajectories of English as a first language (EL1s;ÊnÊ= 43) and English learners (ELs;ÊnÊ= 108) in general, and in groups of EL1s and ELs with typically developing and poor reader profiles. In relation to their EL1 or EL reference group, students were classified in Grade 4 as typical readers (nÊ= 72), poor decoders (nÊ= 53), or poor comprehenders (nÊ= 26), with EL1s and ELs proportionally represented in each group. The effects of language, grade level, and reading group on story-writing measures were examined. Both EL1s and ELs developed story-writing skills in a similar manner, showing significant growth between Grades 4 and 6. Typically developing ELs attained age-appropriate story-writing levels. Poor decoders and poor comprehenders showed similar profiles of strengths and weaknesses, regardless of whether English was their first or second language.ÊBothÊpoor reader groups had significant difficulties in story-writing, struggling with the mechanics of writing, sentence structure, and story organization. Findings are discussed in terms of the interconnected relationship between reading and writing profiles, and the importance of a comprehensive understanding of sources of learning difficulties in ELs and EL1s.",201,0.0,0.0,44.776119402985074,4.975124378109452,0.0,0
