Study ID,Journal ID,Volume #,Issue #,Year,Title,Author #1,Design,text ,NW,CC,ADVCL,DOBJ,SCONJ,IC,Binary_design
176,EC,85,1,2018,Are TodayÕs Students With Disabilities More Likely to Attend Full-Day Kindergarten or Part-Day Kindergarten? Analysis of Two Cohorts of Students and Their Teachers,Michael Gottfried,Non-EXP,"Some education policy analysts have called for increased participation of young children in full-day kindergarten programs as opposed to part-day kindergarten. However, little is known about whether students with disabilities are increasingly attending these programs and what their teachers are like. This study addresses this gap by examining whether the full-day kindergarten-going patterns have changed within two nationally representative cohorts of kindergartners (Early Childhood Longitudinal StudyÐKindergarten classes of 1998 and 2010). The findings suggest that a greater percentage of students with disabilities are enrolled in full-day kindergarten programs in 2010 (approximately 80%) than in 1998 (approximately 55%). Comparing full-day kindergarten enrollees between the two cohorts, there were no differences in teachersÕ years of experience or degrees, though full-day kindergarten enrollees in 2010 had teachers with less early education and special education coursework. However, full-day kindergarten enrollees in 2010 were more likely to be in classrooms with a special education teacherÕs aide. Implications are discussed.",162,6.172839506172839,6.172839506172839,24.691358024691358,30.864197530864196,6.172839506172839,0
177,EC,85,1,2018,Using Regression Discontinuity to Estimate the Effects of a Tier-1 Research-Based Mathematics Program in Seventh Grade,Asha K. Jitendra,EXP,"The present study used a regression discontinuity approach to test whether schema-based instruction (SBI) was effective for students identified with varying levels of mathematics difficulties (MD) who received Tier-1 instruction. The performance of these students was compared to similar students who received business-as-usual Tier-1 instruction. Results indicated SBI on average raised scores regardless of whether a student was categorized as having MD on outcome measures of mathematics problem solving, suggesting that SBI is effective for a wide range of proportional reasoning skills and general mathematical proficiency, which broadens the population of students who could benefit from SBI. Standardized slopes for the treatment effect also provide evidence of the effectiveness of SBI. Implications for practice and research are discussed.",121,0.0,0.0,66.11570247933885,24.793388429752067,0.0,1
178,LDQ,42,2,2019,Exploring Growth Trajectories of Informal and Formal Mathematics Skills Among Prekindergarten Children Struggling With Mathematics,Jessica M. Namkung,Non-EXP,"Growth in two subscales, Informal and Formal Mathematics Skills, of theÊTest of Early Mathematics AbilitityÐ3Ê(TEMA-3) was explored in a sample of 281 children. Children were identified as either typically developing (TYP;ÊnÊ= 205) or having mathematics difficulties (MD;ÊnÊ= 76) based on their total TEMA-3 score at the end of prekindergarten. Their average level of informal and formal mathematics skills, growth rate over time, and rate of acceleration of growth were estimated using conventional growth modeling while controlling for the effects of gender. Results indicated that children with MD had significantly lower informal and formal mathematics knowledge than did TYP children at the end of kindergarten. However, for informal mathematics skills, children with MD grew at a significantly faster rate than did TYP children, and the rate of acceleration was also significantly faster for children with MD. In contrast, both the rate of growth and acceleration of growth in formal mathematics skills were significantly faster for TYP children than they were for children with MD. Implications for early MD identification and interventions are discussed.",172,0.0,0.0,23.25581395348837,29.069767441860463,0.0,0
179,LDQ,42,2,2019,The Influence of Oral Versus Silent Reading on Reading Comprehension in Students With Reading Disabilities,Melissa M. Robinson,EXP,"This study examined the effects of reading modality (oral vs. silent) on comprehension in elementary school students with a specific learning disability in reading (NÊ= 77). A 2 (development-level) _ 2 (reading modality) _ 2 (time) mixed factorial analysis of variance (ANOVA) was conducted to determine the influence of these variables on comprehension. Significant main effects were found for reading modality and time on comprehension, but the main effect for developmental level was not significant. Students understood more of what was read orally than silently and showed improved comprehension across the year. The development-level by modality interaction was significant. Early elementary students benefited from oral reading in terms of comprehension, whereas equivalent comprehension was observed for late elementary students across modalities. No other two- or three-way interactions were significant. Results from this study suggest that reading modality is an important variable to consider for researchers and educators who are interested in the construct of reading comprehension.",157,0.0,0.0,44.58598726114649,12.738853503184714,0.0,1
180,LDQ,42,3,2019,Instruction in District-Designed Intensive Summer Reading Programs,Jessica S. Folsom,EXP,"This study reports on the instruction provided in district-designed intensive summer reading programs. The Tier 3 intervention was provided to 374 students from 24 school districts who were not meeting the end of third-grade reading benchmarks; students were exiting third grade and entering fourth grade. Observations of the 40 classes were conducted near the beginning, middle, and end of the average 23 days of instruction, and analyzed to capture the proportion of time spent in various instructional groupings (e.g., whole class, small group) and components (e.g., phonological awareness, comprehension). Findings revealed that most time was spent in whole-class instruction, despite the need to offer students a more intensive intervention. Only two thirds of instructional time was spent specifically in reading-related activities. Approximately 30% of literacy instruction was code-focused (e.g., phonics), and 70% was meaning-focused (e.g., comprehension). The discussion addresses the alignment of observations with prior research on effective instruction and implications for designing future district-designed intensive summer reading programs.",166,0.0,0.0,42.16867469879518,12.048192771084338,6.024096385542169,1
181,LDQ,42,4,2019,Teaching Academic Vocabulary to Sixth-Grade Students With Disabilities,Rollanda E. O'Connor,EXP,"Adolescents with disabilities have great difficulty with academic content in middle school, and their teachers have difficulty teaching them to understand and use academic language. We taught teachers of sixth-grade students with learning disabilities, more than half of whom were also English language learners (ELLs), to implement about 15 min of daily interactive vocabulary instruction in their intact special education English/language arts classes. Three schools were assigned randomly to treatment (two schools) or control conditions (one school, 52 students total). We developed instructional routines to introduce four new words per week in three 4-week units to test for replicability. ANCOVAs (with each cycleÕs pretest and intelligence quotient as covariates) were conducted on taught vocabulary, all of which favored the treatment condition with effect sizes ranging .6 to .7 per cycle. Near-transfer effects to vocabulary usage were weaker, with significant effects in the last two cycles. Effects were similar for students with disabilities who were ELLs and native English speakers. Treated students maintained their knowledge of words 4 to 24 weeks following the close of treatment.",179,0.0,0.0,61.452513966480446,0.0,5.58659217877095,1
182,LDQ,40,1,2017,Culturally and Linguistically Responsive Schema Intervention:ÊImproving Word Problem Solving for English Language Learners With Mathematics Difficulty,Melissa K. Driver,EXP,"Word problems are prevalent on high-stakes assessments, and success on word problems has implications for grade promotion and graduation. Unfortunately, English Language Learners (ELLs) continue to perform significantly below their native English-speaking peers on mathematics assessments featuring word problems. Little is known about the instructional needs and performance of ELLs at risk of mathematics difficulty (MD). In the present study, an exploratory quasi-experimental design was used to investigate word-problem instruction for ELLs in a culturally and linguistically diverse public elementary school. Specifically, we studied the efficacy of a word-problem intervention for ELLs with MD (NÊ= 9) that combined culturally and linguistically responsive practices with schema instruction (CLR-SI). The study is unique in that it combines research on effective instruction for ELLs and students with MD; CLR-SI has not been investigated for either ELLs or students with MD. Results have implications for teachers, administrators, and researchers of ELLs with MD.",156,0.0,0.0,44.87179487179487,12.82051282051282,0.0,1
183,LDQ,40,2,2017,Effects of an Informational Text Reading Comprehension Intervention for Fifth-Grade Students,Kristen D. Ritchey,EXP,"Upper elementary school students who have reading problems may have difficulty in one or more areas of reading, each requiring specific types of interventions. This study evaluated a short-term reading intervention for 46 fifth-grade students with poor reading comprehension. Students were randomly assigned to an intervention or no treatment control condition. The 40 session (20 hr) intervention targeted reading comprehension strategy instruction in the context of informational science texts. Analyses showed statistically significant effects favoring the intervention on two proximal measures (i.e., measures closely related to the intervention content). The effects for the outcomes were moderate (gs = 0.61 and 0.72). There were no statistically significant differences on distal measures (i.e., measures less closely aligned with the intervention). The findings provide support for the efficacy of a reading comprehension intervention that may inform short-term interventions within a Response to Intervention framework.",144,0.0,0.0,62.5,0.0,0.0,1
184,LDQ,40,4,2017,A Practitioner Implementation of a Tier 2 First-Grade Mathematics Intervention,Mari G. Strand Cary,EXP,"We report on a practitioner implementation of Fusion, a first-grade mathematics intervention. Studies such as this evaluation of a loose implementation under realistic conditions are important to curriculum developersÕ understanding of how evidence-based programs and tools work under a variety of implementation scenarios. In this quasi-experimental study, first-grade students (nÊ= 253) in 10 schools were assigned to treatment (nÊ= 154) or control (nÊ= 99). Rather than randomly assigning students, schools assigned those students most at risk to treatment and, typically, those less at risk to control. School staff administered pre- and postassessments and led Fusion sessions approximately 30 min per day, 3 days per week. The intervention resulted in a significant positive effect on a researcher-developed first-grade math measure. The implementation of Fusion and feedback from school staff provided insights to guide the curriculum development process.",142,0.0,0.0,56.33802816901409,7.042253521126761,14.084507042253522,1
185,LDQ,40,4,2017,Strategies Students With and Without Mathematics Disabilities Use When Estimating Fractions on Number Lines,Dake Zhang,Non-EXP,"We examined faulty strategies with possible underlying misconceptions, as well as execution mistakes, among middle schoolers with and without mathematics disabilities when estimating fractions on number lines. Fifty-one middle schoolers participated in this study, including 27 students with mathematics disabilities. Participants were asked to estimate 10 fractions on a 0-1 number line and 11 fractions on a 0-5 number line and explain their procedures. We identified two incorrect strategies (i.e., not-on-the-line and ruler-tick-mark counting strategy) and two execution mistakes (i.e., unequal segmentation based on denominator and inaccurate numerical transformation) on both number-line estimation tasks. We also identified one additional faulty strategy (i.e., treating 0-5 as the 0-1 number line) with the 0-5 number-line estimation tasks. Students with mathematics disabilities were significantly more likely to use the faulty strategies than students without mathematics disabilities. The faulty strategies, rather than execution mistakes, were consistent across two number-line tasks and predicted studentsÕ performance in other fraction problem-solving tasks. Results illustrated specific problems that students with and without mathematics disabilities encountered when using number lines to illustrate fractions. We discussed possible negative influences of using rulers to teach fractions and how to help students to construct the concept of units.",211,0.0,0.0,71.09004739336493,14.218009478672984,4.739336492890995,0
186,LDQ,39,3,2016,The Effects of an Inference-Making Strategy Taught With and Without Goal Setting,Deborah K. Reed,EXP,"This quasi-experimental study examined the effects of a strategy for making text-dependent inferencesÑwith and without embedded self-regulation skillsÑon the reading comprehension of 24 middle-grade students with disabilities. Classes were randomly assigned to receive the inference intervention only (IO), inference + individual goal setting (IIG), or inference + group goal setting (IGG). The KruskalÐWallis one-way analysis of variance revealed no significant differences between groups on overall reading comprehension performance, but students in the IGG group significantly outperformed the IO and IIG groups on evaluation items, _2(2,ÊNÊ= 24) = 13.18,ÊpÊ= .001. Paired samplesÊtÊtests indicated all groups significantly improved their comprehension performance from pre- to posttest, IO:Êt(8) = 2.76,ÊpÊ< .05; IIG:Êt(6) = 3.97,ÊpÊ< .01; IGG:Êt(7) = 4.35,ÊpÊ< .01. The IGG group wrote significantly more valid inferences in Lessons 3 to 7 than the IO or IIG groups; _2(2) ranged from 7.26,ÊpÊ< .05, to 16.16,ÊpÊ< .001.",155,0.0,0.0,51.61290322580645,0.0,0.0,1
187,LDQ,39,4,2016,Does Supplemental Instruction Support the Transition From Spanish to English Reading Instruction for First-Grade English Learners at Risk of Reading Difficulties?,Doris Luft Baker,EXP,"This study examines the effect of 30 min of small group explicit instruction on reading outcomes for first-grade Spanish-speaking English learners (ELs) at risk of reading difficulties. Participants were 78 ELs from seven schools who were receiving Spanish only, or Spanish and English, whole group reading instruction in first grade. Students were rank-ordered within schools and then randomly assigned to a treatment condition (nÊ= 39) or a comparison condition (nÊ= 39). Students in the treatment condition received instruction on transition elements that supported their transfer of skills from Spanish to English. Students in the comparison condition received Business as Usual instruction from a variety of commercially available programs. Findings indicated that ELs in both conditions made significant gains from pretest to posttest on all reading outcomes even though instruction in the treatment condition focused significantly more on higher order skills (i.e., vocabulary, comprehension, and transition elements) whereas instruction in the comparison condition focused significantly more on lower order skills (i.e., phonics, word work, and sentence reading). Implications for practice and future research are discussed.",177,5.649717514124294,5.649717514124294,50.84745762711865,16.949152542372882,5.649717514124294,1
189,JLD,50,1,2017,Can Dyscalculics Estimate the Results of Arithmetic Problems?,Dana Ganor-Stern,Non-EXP,"The present study is the first to examine the computation estimation skills of dyscalculics versus controls using the estimation comparison task. In this task, participants judged whether an estimated answer to a multidigit multiplication problem was larger or smaller than a given reference number. While dyscalculics were less accurate than controls, their performance was well above chance level. The performance of controls but not of those with developmental dyscalculia (DD) improved consistently for smaller problem sizes. The performance of both groups was superior when the reference number was smaller (vs. larger) than the exact answer and when it was far (vs. close) from it, both of which are considered to be the markers of the approximate number system (ANS). Strategy analysis distinguished between an approximated calculation strategy and a sense of magnitude strategy, which does not involve any calculation but relies entirely on the ANS. Dyscalculics used the latter more often than controls. The present results suggest that there is little, if any, impairment in the ANS of adults with DD and that their main deficiency is with performing operations on magnitudes rather than with the representations of the magnitudes themselves.",191,0.0,0.0,26.17801047120419,41.88481675392671,0.0,0
190,JLD,50,1,2017,Defective Number Sense or Impaired Access? Differential Impairments in Different Subgroups of Children With Mathematics Difficulties,Terry T - Y Wong,Non-EXP,"Developmental dyscalculia (DD) is a specific learning disability in mathematics that affects around 6% of the population. Currently, the core deficit of DD remains unknown. While the number sense deficit hypothesis suggests that the core deficit of DD lies in the inability to represent nonsymbolic numerosity, the access deficit hypothesis suggests that the origin of this disability lies in the inability to associate numbers with the underlying magnitude representation. The present study compared the performance of DDs with their low-achieving (LA) and normally achieving peers in nonsymbolic numerosity processing and number-magnitude mapping over 1 year (from kindergarten to 1st grade). The results demonstrated differential impairments in different subgroups of children with mathematics difficulties. While DDs showed deficits in both nonsymbolic numerosity processing and number-magnitude mapping, LAs showed deficit only in the number-magnitude mapping. Furthermore, the deficit in number-magnitude mapping among the DD group was partially explained by their number sense deficit. The number sense deficit hypothesis is supported. Theoretical and practical implications are discussed.",169,0.0,0.0,53.25443786982249,23.668639053254438,11.834319526627219,0
191,JLD,50,1,2017,A Randomized Control Trial of Working Memory Training With and Without Strategy Instruction:ÊEffects on Young ChildrenÕs Working Memory and Comprehension,Peng Peng,EXP,"Researchers are increasingly interested in working memory (WM) training. However, it is unclear whether it strengthens comprehension in young children who are at risk for learning difficulties. We conducted a modest study of whether the training of verbal WM would improve verbal WM and passage listening comprehension and whether training effects differed between two approaches: training with and without strategy instruction. A total of 58 first-grade children were randomly assigned to three groups: WM training with a rehearsal strategy, WM training without strategy instruction, and controls. Each member of the two training groups received a one-to-one, 35-min session of verbal WM training on each of 10 consecutive school days, totaling 5.8 hr. Both training groups improved on trained verbal WM tasks, with the rehearsal group making greater gains. Without correction for multiple group comparisons, the rehearsal group made reliable improvements over controls on an untrained verbal WM task and on passage listening comprehension and listening retell measures. The no-strategy-instruction group outperformed controls on passage listening comprehension. When corrected for multiple contrasts, these group differences disappeared but were associated with moderate to large effect sizes. Findings suggestÑhowever tentativelyÑthat brief but intensive verbal WM training may strengthen the verbal WM and comprehension performance of young children at risk. Necessary caveats and possible implications for theory and future research are discussed.",224,0.0,0.0,53.57142857142857,17.857142857142858,4.464285714285714,1
192,JLD,50,1,2017,Development of First-GradersÕ Word Reading Skills:ÊFor Whom Can Dynamic Assessment Tell Us More?,Eunsoo Cho,Non-EXP,"Dynamic assessment (DA) of word reading measures learning potential for early reading development by documenting the amount of assistance needed to learn how to read words with unfamiliar orthography. We examined the additive value of DA for predicting first-grade decoding and word recognition development while controlling for autoregressive effects. Additionally, we examined whether predictive validity of DA would be higher for students who have poor phonological awareness skills. First-grade students (nÊ= 105) were assessed on measures of word reading, phonological awareness, rapid automatized naming, and DA in the fall and again assessed on word reading measures in the spring. A series of planned, moderated multiple regression analyses indicated that DA made a significant and unique contribution in predicting word recognition development above and beyond the autoregressor, particularly for students with poor phonological awareness skills. For these students, DA explained 3.5% of the unique variance in end-of-first-grade word recognition that was not attributable to autoregressive effect. Results suggest that DA provides an important source of individual differences in the development of word recognition skills that cannot be fully captured by merely assessing the present level of reading skills through traditional static assessment, particularly for students at risk for developing reading disabilities.",206,0.0,0.0,72.81553398058252,24.271844660194173,0.0,0
193,JLD,50,2,2017,Impact of Intensive Summer Reading Intervention for Children With Reading Disabilities and Difficulties in Early Elementary School,Joanna A. Christodoulou,EXP,"Efficacy of an intensive reading intervention implemented during the nonacademic summer was evaluated in children with reading disabilities or difficulties (RD). Students (ages 6Ð9) were randomly assigned to receive Lindamood-BellÕsÊSeeing StarsÊprogram (nÊ= 23) as an intervention or to a waiting-list control group (nÊ= 24). Analysis of pre- and posttesting revealed significant interactions in favor of the intervention group for untimed word and pseudoword reading, timed pseudoword reading, oral reading fluency, and symbol imagery. The interactions mostly reflected (a) significant declines in the nonintervention group from pre- to posttesting, and (2) no decline in the intervention group. The current study offers direct evidence for widening differences in reading abilities between students with RD who do and do not receive intensive summer reading instruction. Intervention implications for RD children are discussed, especially in relation to the relevance of summer intervention to prevent further decline in struggling early readers.",148,0.0,0.0,67.56756756756756,0.0,0.0,1
194,JLD,50,2,2017,Old/New Effect of Digital Memory Retrieval in Chinese Dyscalculia:ÊEvidence from ERP,Enguo Wang,Non-EXP,"This study reports the neurophysiological and behavioral correlates of digital memory retrieval features in Chinese individuals with and without dyscalculia. A total of 18 children with dyscalculia (ages 11.5Ð13.5) and 18 controls were tested, and their event-related potentials were digitally recorded simultaneously with behavior measurement. Behavioral data showed that the dyscalculia group had lower hit rates and higher false rates than the control group. The electroencephalography results showed that both groups had a significant old/new effect and that this effect was greater in the control group. In the 300 to 400 ms processing stages, both groups showed significant differences in digital memory retrieval in the frontal regions. In the 400 to 500 and 500 to 600 ms epochs, the old/new effect in the control group was significantly greater than it was in the dyscalculia group at the frontal, central, and parietal regions. In the 600 to 700 ms processing stages, both groups showed significant differences in digital memory retrieval in the frontal, central, parietal, and occipital regions. These results suggest that individuals with dyscalculia exhibit impaired digital memory retrieval. Extraction failure may be an important cause of calculation difficulties.",192,0.0,0.0,26.041666666666668,26.041666666666668,5.208333333333333,0
