Study ID,Journal ID,Volume #,Issue #,Year,Title,Author #1,Design,text ,NW,CC,ADVCL,DOBJ,SCONJ,IC,Binary_design
104,LDQ,45,1,2022,Clues: Using Generative Strategies to Improve the Science Vocabulary of Secondary English Learners With Reading Disabilities,Amanda Helman,EXP,"English learners (ELs) with reading disabilities (RDs) have been among the lowest performers on academic achievement tests that assess vocabulary. To meet academic demands and prepare for college or careers, ELs with RDs clearly need support in terms of vocabulary acquisition; however, relevant research is scarce. This study investigated the effects of the CLUES strategy, a generative vocabulary strategy, on the ability of students to analyze and define unknown science terms relating to biology. The study further evaluated studentsÕ ability to maintain vocabulary gains over time and to generalize the CLUES strategy. The results showed that participants benefited from the use of the CLUES approach to define novel science terms and maintain their ability to use this strategy over time. The participants themselves generally expressed satisfaction with the CLUES strategy and recommended it to their peers.",136,0.0,0.0,102.94117647058823,7.352941176470588,14.705882352941176,1
105,LDQ,45,1,2022,The Effect of a Morphological Awareness Intervention on Early Writing Outcomes,Abihgail A. Allen,EXP,The purpose of this study was to investigate the effect of a morphological awareness intervention on the spelling and writing of second-grade (nÊ= 16) and third-grade (nÊ= 10) students at risk for learning disabilities. The intervention was provided for 25 min per session 4 to 5 times per week for 5 weeks. Students were randomly assigned to the intervention (nÊ= 13) or comparison (nÊ= 13) condition. Students were pre- and posttested using standardized tests of spelling and writing and were progress monitored twice weekly with a curriculum-based measure of writing. Intervention effects were measured using a univariate analysis of covariance (ANCOVA) on each outcome. Growth on the progress monitoring task was measured using hierarchical linear modeling (HLM). Results indicated the intervention did not have a significant effect on outcomes but a moderate positive effect was detected on writing. Practical applications including intervention revisions and feasibility of use are discussed.,152,0.0,0.0,46.05263157894736,0.0,0.0,1
106,LDQ,45,2,2022,"High School Co-Teaching PartnersÕ Self-Efficacy, Personal Compatibility, and Active Involvement in Instruction",Todd M. Johnson,Non-EXP,"High school co-teachers prepare students with and without disabilities to earn content credits for graduation, with instructional effectiveness influenced by multiple factors. In this study, teacher self-efficacy and personal compatibility were examined as potential predictors of active involvement in instruction. The moderating effect of personal compatibility on the relationship between teacher self-efficacy and active involvement in instruction was also examined. One hundred twenty-seven co-teachers of students with learning disabilities and other high-incidence disabilities participated. Active involvement in instruction was significantly higher for general educators than for special educators. Results of ActorÐPartner Interdependence Model (APIM) analyses revealed teacher self-efficacy was predictive of active involvement in instruction for general educators but not for special educators. Results of APIM with moderation found personal compatibility did not significantly moderate the relationship between teacher self-efficacy and active involvement in instruction for general or special education co-teachers. Implications for co-teaching practices are provided.",157,0.0,0.0,25.477707006369428,0.0,0.0,0
107,LDQ,45,2,2022,Continuing CHAAOS: Vocabulary Intervention for Students With Disabilities in Eighth Grade Who Are Also English Learners,Rollando E. O' Connor,EXP,"Few studies have considered academic vocabulary interventions for students who have learning disabilities (LD) and also are English learners (EL). This research explored the effects of the third year of the Creating Habits that Accelerate Academic Language of Students (CHAAOS) vocabulary intervention for eighth-grade students who received English Language Arts instruction (ELA) in special education classes. Over 70% of student participants had LD and over half were EL. Special education teachers delivered 12 weeks of intervention spaced across 7 months to 36 students. Researchers compared outcomes on receptive and expressive measures with 17 students in business-as-usual (BAU) special education ELA. Students receiving the CHAAOS intervention learned the 48 taught words better than students in BAU conditions, retained their knowledge of words 4 weeks following the close of the intervention, and ended the year with higher vocabulary scores on a standardized measure than students in BAU classes. Students who were EL performed similarly on receptive knowledge of words to students who were native English speakers. This study documents the effectiveness of explicit vocabulary routines for students who have LD and are also EL.",185,0.0,0.0,70.27027027027027,0.0,5.405405405405405,1
108,LDQ,45,2,2022,Prior Academic Achievement as a Predictor of Non-Cognitive Variables and Teacher and Parent Expectations in Students With Learning Disabilities,Jose C. Nunez,Non-EXP,"Research has suggested that the relationship between previous academic achievement and student variables is mediated by parent and teacher expectations of the childÕs ability and future success. The goal of this study was to analyze the mediating role of teachersÕ expectations and teachersÕ perceptions of parentsÕ expectations between previous academic achievement and variables in students with Specific Learning Disorders (SLD) that are significant for school learning. The participants were 230 students with SLD from Spain, between 10 and 14 years old. Extrinsic variables influenced the studentsÕ intrinsic variables even more than the studentsÕ own experiences of academic success or failure. The way in which teachers in the childÕs academic life respond to prior results and the expectations they form can affect their instruction and, ultimately, the childrenÕs motivation, involvement, and persistence in learning.",133,0.0,0.0,30.075187969924812,7.518796992481203,7.518796992481203,0
109,LDQ,45,2,2022,Executive Function and Planning Features of Students With Different Types of Learning Difficulties in Chinese Junior Middle School,Meiqi Deng,Non-EXP,"The aim of the present study was to investigate the executive function and planning features of students with different types of learning difficulties. Students with mathematics difficulty (MD;ÊnÊ= 17), reading difficulty (RD;ÊnÊ= 12), and their commonalities (MDRD;ÊnÊ= 22), along with typically academically developing peers (TD;ÊnÊ= 22), were evaluated on an array of cognitive measures (working memory, inhibition, and planning) individually. Results revealed significant differences among groups on various cognitive measures. Students in the MD, RD, and MDRD groups showed poorer performance compared to the TD group on all of the working memory, inhibition, and planning tasks. The MDRD group showed an overall weakness when compared to other groups, indicating severe cognitive deficits in students with MDRD. The RD group showed deficits in inhibition and planning on tasks requiring verbal skills; MD students showed deficits in inhibition and planning on digit-related tasks. However, no salient difference was found among the MD, RD, and TD groups on working memory. Results have implications for understanding the cognitive features of MD, RD, and MDRD. Intervention programs targeting inhibition and planning may be beneficial for improving reading and mathematics achievement in students with learning difficulties.",191,0.0,0.0,78.53403141361257,5.235602094240838,0.0,0
110,LDQ,45,2,2022,Technical Adequacy of a Spelling Curriculum-Based Measure for English Language Learners in the First Through Third Grades,R. Alex Smith,Non-EXP,"This study represents an initial examination of the potential of word dictation (WD), a form of curriculum-based measure, to identify risk in writing for young English language learners (ELs). The sample included 73 ELs with beginning to advanced English language proficiency in the first to third grades attending schools in one U.S. Midwestern school district. This district used an English-only model of instruction and students completed two forms of WD in the fall, winter, and spring. The criterion measure, a common English language proficiency assessment, was administered in the winter. Results indicated that WD maintained similar reliability and validity coefficients between the ELs in this study and previous studies with the general population. Implications for practice and future research are discussed.",123,0.0,0.0,56.91056910569105,8.130081300813009,0.0,0
111,LDQ,45,3,2022,Socioemotional Characteristics of Children With and Without Learning Disabilities,Orly Yazdi-Ugav,Non-EXP,"The purpose of the study was to characterize the relationships between behavior problems, academic achievement, and loneliness of students in the upper and lower thirds of a social skills classification. Participants were 733 students (359 boys and 374 girls) ages 9 to 14 years, 642 without learning disabilities (LDs) and 91 with LDs. Their homeroom teacher rated their social skills, and accordingly the upper and lower thirds of social skills scores were determined. Results showed differences in behavior problems between the low and high social skills groups. Boys displayed higher rates of behavior problems. Students with LDs achieved lower scores than their peers in academic achievements and higher scores in loneliness. The final model of the binary stepwise logistic regression showed that loneliness, behavior problems, and academic achievements were related to social skills, explaining 60% of the pseudo-variance (Cox & SnellÊR2Ê= .60). The findings help target individual variables that can promote school adjustment.",153,0.0,0.0,58.8235294117647,6.5359477124183005,6.5359477124183005,0
112,LDQ,45,3,2022,The Social and Academic Effects of Cooperative LEARN Strategy Instruction in Inclusive Elementary Classes,D. Sue Vernon,EXP,"This study reports the effects of instruction of elementary students in a complex package of social and academic skills designed for use in cooperative groups while studying important information in inclusive general education classes. Twenty-five teachers and 519 fourth and fifth graders, including 45 students with learning disabilities (LD), participated. A pretest/posttest control-group design with random assignment was used to determine the effects of the instructional program. Data were analyzed for students with LD, all students with exceptionalities, and average-achieving (AA) students. Results indicated that experimental studentsÕ scores on study-group performance, study-card creation, and tests of social and academic knowledge were significantly higher than control studentsÕ scores. Furthermore, the number of prosocial behaviors and teamwork behaviors significantly increased for all subgroups of experimental students during study-group tasks, including students with LD and students with exceptionalities. Also, the number of antisocial behaviors significantly decreased for students with LD and students with exceptionalities.",158,0.0,0.0,25.31645569620253,12.658227848101266,0.0,1
113,LDQ,45,3,2022,The Impact of a Cognitive and Motivational Reading Intervention on the Reading Achievement and Motivation of Students At-Risk for Reading Difficulties,Miriam Mc.Breen,EXP,"This research assessed the impact of combining small-group cognitive reading intervention with a motivational program targeting studentsÕ goals, emotions, and self-efficacy beliefs on the reading performance and motivation of third-grade students at risk for reading difficulties (nÊ= 25,ÊMageÊ= 8.99,ÊSDÊ= 0.38). Using a quasi-experimental pre-test/post-test efficacy trial design, effects of the intervention on phonological awareness, listening comprehension, accuracy, fluency, reading comprehension, and motivation were assessed. Results indicate that compared with students who received Cognitive-Only reading intervention, students who received the combined Cognitive plus Motivational reading intervention showed greater gains in reading comprehension and phonological awareness. Findings provide preliminary evidence that supplementing cognitive reading intervention with the proposed motivational program can improve the reading performance of students at risk for reading difficulties.",128,0.0,0.0,101.5625,15.625,0.0,1
114,LDQ,45,3,2022,Hidden Reading Difficulties: Identifying Children Who Are Poor Comprehenders,Katrina Kelso,Non-EXP,"Poor comprehenders are a significant subgroup of poor readers who, due to their ability to read aloud accurately, are often difficult to identify. This study aimed to determine whether assessment using two oral language tasks, mapped onto the two components of the Simple View of Reading, would provide an efficient approach to identification. Children (NÊ= 218) from School Years 3 to 6 (ages 7; 8Ð12; 1) attending two schools in Australia were assessed, and 45 identified as potential poor comprehenders, based on a profile of average phonological awareness but poor listening comprehension. Subsequent assessment of decoding and text reading comprehension confirmed 24 of these children to be poor comprehenders, consistent with reported prevalence rates. Five of these children were judged to be weak readers by their classroom teacher. The oral tasks alone overidentified this group; however, the findings suggest that using the tasks as an initial phase, followed up with a reading assessment, could be effective in identifying poor comprehenders, and reduce time spent in testing as this would only involve at-risk children.",174,5.747126436781609,0.0,51.724137931034484,11.494252873563218,5.747126436781609,0
115,LDQ,45,4,2022,Investigating the Promise of a Tier 2 Sixth-Grade Fractions Intervention,Ben Clarke,EXP,This pilot study examined the promise of a Tier 2 Grade 6 intervention program for students at risk for difficulties in mathematics. The study utilized a quasi-experimental design. The final sample included 112 students in treatment (Promoting Algebra Readiness) and 86 students in control (standard district practice) conditions. The Promoting Algebra Readiness program consisted of 93 lessons across four strands focused on key concepts and applications of fractions. Measures of mathematics achievement were collected at pretest and posttest. Feasibility and usability data indicated favorable impressions by users and strong levels of implementation fidelity. Gain scores of treatment students were significantly greater than those of control peers on two of four proximal measures of mathematics achievement. Positive nonsignificant effects were found on additional proximal and distal measures. Implications for educators delivering instruction for at-risk students in multitier service delivery models are discussed.,143,0.0,0.0,48.95104895104895,0.0,0.0,1
116,LDQ,45,4,2022,Word- and Text-Level Reading Difficulties in Students With Dyslexia,Elizabeth B. Meisinger,Non-EXP,"The purpose of this study was to examine whether group-based differences exist in word- and text-level reading in a clinical sample of students with dyslexia, and to shed light on the cognitive processes supporting these essential skills. Second- through seventh-grade students were administered a battery of standardized measures of cognitive processing skills (phonological awareness, rapid automatized naming [RAN], and verbal short-term memory), word reading skills (decoding and word identification), oral text reading (fluency and comprehension), and silent text reading (fluency and comprehension). Word- and text-level reading skills were used to place students into the following groups: text fluency deficit, globally impaired, and partially remediated. Results replicated the existence of a text fluency deficit group. Reader group differences in terms of cognitive processing skills were less pronounced than expected, with only phonological awareness differentiating among them. Phonological awareness and RAN emerged as the important contributors to reading skill, though their relative contributions varied across word- and text-level measures. Together, these results point to importance of considering text-level reading processes across modality in both research and clinical contexts.",183,5.46448087431694,5.46448087431694,54.6448087431694,16.393442622950822,10.92896174863388,0
117,LDQ,45,4,2022,Predicting Intervention Effects With Preintervention Measures of Decoding: Evidence for a Skill-by-Treatment Interaction With Kindergarten and First-Grade Students,Matthew K. Burns,EXP,"A skill-by-treatment interaction (STI) isolates skill deficits and manipulates conditions to match them to student needs. Based on the learning hierarchy, preintervention scores can help predict which intervention will be most successful for an individual student. This study compared the efficacy of a modeling and practice-based decoding intervention for 29 kindergarten and first-grade students. Results suggested that grade was not a significant predictor of which intervention was more effective, but preintervention accuracy in nonsense word fluency was a significant predictor of the more effective intervention, accounted for 68% of the variance, and correctly identified the more effective intervention 88% of the time.",106,0.0,0.0,47.16981132075472,9.433962264150942,9.433962264150942,1
118,LDQ,44,1,2021,Teaching Rate of Change and Problem Solving to High School Students With High Incidence Disabilities at Tier 3,Kaitlin Bundock,EXP,"Implementing an integrated sequence of concrete-representational-abstract depictions of mathematics concepts (CRA-I) can improve the mathematics achievement of students with disabilities, and explicit instructional strategies involving problem-solving heuristics and student verbalizations can help facilitate studentsÕ conceptual understanding of mathematics. Combining CRA-I and explicit instructional strategies may increase studentsÕ conceptual understanding and ability to express mathematical reasoning through writing. This study included three ninth-grade students with disabilities, and employed a multiple-probe design across-participants to investigate a functional relation between an explicit instructional strategy within a CRA-I framework and high school studentsÕ with disabilities proficiency in solving rate of change problems. Results showed that all three students improved their mathematics scores (combined Tau-UÊeffect size = 0.77,ÊpÊ< .001) and maintained improvements during a 1- to 7-week post-instruction phase. Implications for research and practice related to mathematics instruction and intervention specifically for students with learning disabilities are discussed.",156,0.0,0.0,102.56410256410255,6.41025641025641,12.82051282051282,1
119,LDQ,44,1,2021,Measuring the Quantity and Quality of Explicit Instructional Interactions in an Empirically Validated Tier 2 Kindergarten Mathematics Intervention,Christian T. Doabler,EXP,"Instructional interactions that occur between teachers and students around foundational mathematics topics are critical for supporting mathematical proficiency among students with mathematics learning disabilities (MLD). This study investigated whether the initial mathematics skill of 880 kindergarten students at risk of MLD predicted the quantity and quality of explicit instructional interactions (i.e., overt teacher modeling, student practice opportunities, and academic feedback) experienced during an empirically validated Tier 2 kindergarten mathematics intervention. It also examined whether the quantity and quality of such instructional interactions predicted gains in student mathematics achievement. Researchers conducted 740 direct observations of 255 intervention groups within a multiyear, randomized controlled trial. Results suggested that intervention groups with lower initial mathematics skill received higher rates of academic feedback and made more frequent errors. In addition, more frequent and higher quality academic feedback and group practice opportunities predicted increased mathematics achievement. Implications for investigating the active ingredients of mathematics interventions are discussed.",152,0.0,0.0,46.05263157894736,19.736842105263158,6.578947368421052,1
120,LDQ,44,2,2021,Evaluating Spatial Thinking Ability Using Item Response Theory: Differential Item Functioning Across Math Learning Disabilities and Geometry Instructions,Sam Choo,EXP,"Science, Technology, Engineering, and Mathematics (STEM) education initiatives have placed pressure on teachers to bring technology tools into classroom, including three-dimensional (3D) printing. Yet, little research has examined what specific math skills are required for 3D printing technology. This article describes a follow-up analysis of findings from a quasi-experimental study that tested feasibility of 3D geometry instruction,ÊAnchored Instruction with Technology Applications (AITA), designed to help students visualize and construct 3D models based on Enhanced Anchored Instruction. Although we found that AITA improved math outcomes of students with math learning disabilities (MLD) in the previous analysis, we only used composite scores encompassing a variety of math and spatial tasks. In this study, we employed item response theory and differential item functioning to examine the impacts of MLD on studentsÕ spatial thinking skills, understand the types of items to assess the intended skills in a valid way, and provide a detailed information of whether student ability and MLD status have caused different results to assess studentsÕ spatial thinking skills. Results showed that students with MLD struggle to learn spatial thinking skills, and AITA was a significant positive indicator to improve spatial thinking skills for both students with and without MLD.",202,4.9504950495049505,4.9504950495049505,89.10891089108911,19.801980198019802,14.85148514851485,1
121,LDQ,44,2,2021,Effects of Schematic Chunking on Enhancing Geometry Performance in Students With Math Difficulties and Students at Risk of Math Failure,Dake Chang,EXP,"Schematic chunks denote patterns, schemes, or sophisticated rules and knowledge stored in the long-term memory in the form of chunks. We investigated whether schematic chunking is effective in improving the performance of students with math difficulties (MD) and students at risk of math failure, and how the complexity level of geometry problems and studentsÕ content knowledge moderate the effects of a visual chunking accommodation. A 3 (problem difficulty level) _ 2 (plain version/chunking version) _2 (cheat sheet provided/not provided) mixed design was used. Thirty-three students, including 18 with MD and 15 at risk, were randomly assigned to two groups: A Òcheat sheetÓ of related theorems was provided to one group but not the other. Students in both groups received two versions of a geometry test: (a) a test with a plain figure representation, and (b) a parallel test with coloring and marks that highlighted the elements of a schematic chunk. Results found a main effect of chunking for all participants, and the chunking effect was greater for difficult one-step and multi-step problems than for simple one-step problems. Providing a cheat sheet increased the chunking effects for solving only the difficult one-step problems pertaining to low-frequency theorems for students with MD.",208,0.0,0.0,43.26923076923077,9.615384615384617,0.0,1
122,LDQ,44,2,2021,Comparison of Literacy Screener Risk Selection Between English Proficient Students and English Learners,Kelli D. Cummings,Non-EXP,"Universal screening is a critical component of school-based prevention systems. Screening data enable educators to target students for supplemental intervention, align resources to meet needs, and identify students who may be at risk for learning disabilities. One major requirement of the screening process is that all students are included to gain an accurate picture of school performance. It is therefore surprising that few evaluations of screening systems have focused on English language measures and their use with English learners. In this article, we aim to evaluate common screening thresholds, 54 across Grades kÐ3, to determine the extent to which they may differ between English learners and English proficient students. Results indicate that many thresholds are consistent between groups with some exceptions in kindergarten. We discuss implications for screening assessment and decision making but suggest that similar cut scores across groups do not imply similar intervention strategies.",147,0.0,0.0,68.02721088435375,27.210884353741495,6.802721088435374,0
